{
  "manifest_version": "0.1.0",
  "source": "stackexchange",
  "adapter_version": "0.1.0",
  "target_valid_records": 10,
  "max_items_per_author": 2,
  "published_after": "2026-05-14T15:35:00Z",
  "published_before": "2026-08-12T15:35:00Z",
  "sites": [
    {"name": "stackoverflow", "quota": 3},
    {"name": "superuser", "quota": 3},
    {"name": "serverfault", "quota": 2},
    {"name": "softwareengineering", "quota": 2}
  ],
  "request": {
    "endpoint": "/2.3/questions",
    "sort": "creation",
    "order": "desc",
    "page_size": 30,
    "max_pages_total": 8,
    "max_requests": 12,
    "max_http_attempts": 18,
    "request_timeout_seconds": 10,
    "max_total_elapsed_seconds": 60,
    "max_backoff_wait_seconds": 10,
    "quota_reserve": 100
  },
  "retry": {
    "max_retries": 2,
    "base_backoff_seconds": 1,
    "max_backoff_seconds": 8
  },
  "filter_ref": "stackexchange-filter.json",
  "filter_hash": "3d3c89f1213018080c9c06e1d1f0700df689e350ca8651380c43e9e01cf9674c",
  "compliance_ref": "compliance/stackexchange.json",
  "compliance_hash": "cd90c904d50c3778a3f456d381496a883a7a64b14e0d3218550d0196d23b4a8f",
  "compliance_decision": "conditional"
}
